data/llm/v0.3.0/research/audit-2026-09-16/bigcode--starcoder2-3b.json

{"_id":"6567574b11b2bbd6c2a69e95","id":"bigcode/starcoder2-3b","private":false,"pipeline_tag":"text-generation","library_name":"transformers","tags":["transformers","safetensors","starcoder2","text-generation","code","dataset:bigcode/the-stack-v2-train","arxiv:2305.13245","arxiv:2205.14135","arxiv:2004.05150","arxiv:2207.14255","arxiv:2402.19173","license:bigcode-openrail-m","model-index","text-generation-inference","endpoints_compatible","deploy:azure","region:us"],"downloads":86696,"likes":223,"modelId":"bigcode/starcoder2-3b","author":"bigcode","sha":"733247c55e3f73af49ce8e9c7949bf14af205928","lastModified":"2024-03-04T13:33:12.000Z","gated":false,"disabled":false,"widgetData":[{"text":"def print_hello_world():","example_title":"Hello world","group":"Python"}],"model-index":[{"name":"starcoder2-3b","results":[{"task":{"type":"text-generation"},"dataset":{"name":"CruxEval-I","type":"cruxeval-i"},"metrics":[{"type":"pass@1","value":32.7,"verified":false}]},{"task":{"type":"text-generation"},"dataset":{"name":"DS-1000","type":"ds-1000"},"metrics":[{"type":"pass@1","value":25,"verified":false}]},{"task":{"type":"text-generation"},"dataset":{"name":"GSM8K (PAL)","type":"gsm8k-pal"},"metrics":[{"type":"accuracy","value":27.7,"verified":false}]},{"task":{"type":"text-generation"},"dataset":{"name":"HumanEval+","type":"humanevalplus"},"metrics":[{"type":"pass@1","value":27.4,"verified":false}]},{"task":{"type":"text-generation"},"dataset":{"name":"HumanEval","type":"humaneval"},"metrics":[{"type":"pass@1","value":31.7,"verified":false}]},{"task":{"type":"text-generation"},"dataset":{"name":"RepoBench-v1.1","type":"repobench-v1.1"},"metrics":[{"type":"edit-smiliarity","value":71.19,"verified":false}]}]}],"config":{"architectures":["Starcoder2ForCausalLM"],"model_type":"starcoder2","tokenizer_config":{"bos_token":"<|endoftext|>","eos_token":"<|endoftext|>","unk_token":"<|endoftext|>"}},"cardData":{"pipeline_tag":"text-generation","inference":true,"widget":[{"text":"def print_hello_world():","example_title":"Hello world","group":"Python"}],"datasets":["bigcode/the-stack-v2-train"],"license":"bigcode-openrail-m","library_name":"transformers","tags":["code"],"model-index":[{"name":"starcoder2-3b","results":[{"task":{"type":"text-generation"},"dataset":{"name":"CruxEval-I","type":"cruxeval-i"},"metrics":[{"type":"pass@1","value":32.7,"verified":false}]},{"task":{"type":"text-generation"},"dataset":{"name":"DS-1000","type":"ds-1000"},"metrics":[{"type":"pass@1","value":25,"verified":false}]},{"task":{"type":"text-generation"},"dataset":{"name":"GSM8K (PAL)","type":"gsm8k-pal"},"metrics":[{"type":"accuracy","value":27.7,"verified":false}]},{"task":{"type":"text-generation"},"dataset":{"name":"HumanEval+","type":"humanevalplus"},"metrics":[{"type":"pass@1","value":27.4,"verified":false}]},{"task":{"type":"text-generation"},"dataset":{"name":"HumanEval","type":"humaneval"},"metrics":[{"type":"pass@1","value":31.7,"verified":false}]},{"task":{"type":"text-generation"},"dataset":{"name":"RepoBench-v1.1","type":"repobench-v1.1"},"metrics":[{"type":"edit-smiliarity","value":71.19,"verified":false}]}]}]},"transformersInfo":{"auto_model":"AutoModelForCausalLM","pipeline_tag":"text-generation","processor":"AutoTokenizer"},"siblings":[{"rfilename":".gitattributes","blobId":"a6344aac8c09253b3b630fb776ae94478aa0275b","size":1519},{"rfilename":"README.md","blobId":"f3ca388ede4681cc3125b893b5cbe033972b0903","size":8416},{"rfilename":"config.json","blobId":"bed2a3b56b6f6cd679ac808ac83c1b19265dfd78","size":700},{"rfilename":"merges.txt","blobId":"dc848ee612b08aea786a8cf4abb7fc1ff528a181","size":441705},{"rfilename":"model.safetensors","blobId":"66563e459c45bdf7e259ff7c73bd93a10361e129","size":12121539344,"lfs":{"sha256":"a1217f723be8ee7a03ba085b7af3179f5d60a9183c4b0273c40eb31b9f21f9d6","size":12121539344,"pointerSize":136}},{"rfilename":"special_tokens_map.json","blobId":"be92cbb8ee29740d5e58a8b9b1f867e7eb398602","size":958},{"rfilename":"tokenizer.json","blobId":"d6f3ae7bda4a1718b847d6f9234bd1a69a62ba03","size":2060919},{"rfilename":"tokenizer_config.json","blobId":"7ab761cba63d59f29c68046788766ca886b74364","size":7877},{"rfilename":"vocab.json","blobId":"ce6ed34e317bf5811bb557c2148e4724667e108d","size":777202}],"spaces":["bigcode/bigcode-models-leaderboard","seawolf2357/LLM_Quantization","KBaba7/Quant","FallnAI/Quantize-HF-Models","openfree/LLM_Quantization","bhaskartripathi/LLM_Quantization","Justinrune/LLaMA-Factory","ruslanmv/convert_to_gguf","atlasas/bigcode-models-leaderboard","Canstralian/Transformers-Fine-Tuner","totolook/Quant","K00B404/LLM_Quantization","zhangchenguang/bigcode-starcoder2-3b","aelitta/BioMistral_gradio","Steven10429/apply_lora_and_quantize","Canstralian/bigcode-starcoder2-3b","victor-johnson/emmet-generator","os-odyssey/odyssey-coder","exploitz3r0bbd/Quantize-HF-Models","Xlnk/Quantize-HF-Models","Oss11/Quantize-HF-Models","Zakomako4567/ZewAI-code-generator","Omnibus/Starcode-Completer","JoPmt/Starcoder2_smpl_demo","cistine/starcoder2-3b","dnnsdunca/bigcode-starcoder2-3b","prasannadhungana8848/Rgenerator","mister-g/starcoder2-test","paradiseDev/ConversAI_Playground","Karmastudios/TheWizard","Arrcttacsrks/Chat_X","DanofficeIT/privatellm","Mat17892/iris","szkelo/bigcode-starcoder2-3b","msun415/Llamole","YZ-TAN/flask-llama","KBaba7/llama.cpp","simnJS/Verse","kartik1999/algozai","sakuragolden/coderX","yoleiyyo/mellum-ai-gradio","masjit/auto-grader-starcoder","albmor/llm-hill-climber","mshary55/mmsh","Sarthak-506/Mid-Term-Demo","K00B404/convert_to_gguf","dwrkotech/Dwrko-M1.0","Izaque00/New","inoribea/StarCoder2-3B","Kalduzar/CodeChallanges","arlindabe/ai-code-app-backend","taha-mz87/TahaScript","fakeboyinthehouse100/leetcode-solution-post-genai-backend","rileyrmarketing/my-coding-ai","V3RT3-X1/multiea10strategies","rigoyo/code-hacker-expert","Gzmeplay/MyCodingAI","kararmel04/starcode2-api","Munna1331/1331","Joe6636564/coders","Enzit0/analise-codigo-starcoder","tutu1015/TA","MuratKomurcu/stm32-code-generator","codewithdhs/anycoder-83eb9ff9","subhankarg/MagpieTTS_Internal_Demo","jeancarlosG05/PhoneModels","heavenlydaovenerable/Erebus","reoreoxs/API","GTOMA83/Quantize-HF-Models","Kishore-0606/devops-agent-brain","Lucasidcloned/IacodeBACKUP","ejschwartz/entropy","Mota2art/starcoder2-3b-api-space","Kalyanpannangala/aigendb-prod","nhkr/ai-website-builder","pawakumar/docstring-to-python-code","sidhudumi/AI-MODE","Guilherme34/convert_to_gguf","S777k/openenv-rag-curator","aminefrh/code-hacker-expert","Y4shi/codewatch-demo","sahilksingh/tuneos","joehiggi/g-gen","MikeyBeez/HyperPEER","vishwajith365/sl-coding-agent","kazutab/mindmap-studio","GTO83/LLM_Quantization","blackBolf/MagpieTTS_Internal_Demo"],"createdAt":"2023-11-29T15:22:51.000Z","safetensors":{"parameters":{"F32":3030371328},"total":3030371328},"usedStorage":59489852508}

data/llm/v0.3.0/research/audit-2026-09-16/bigcode--starcoder2-3b--README.md

---
pipeline_tag: text-generation
inference: true
widget:
- text: 'def print_hello_world():'
  example_title: Hello world
  group: Python
datasets:
- bigcode/the-stack-v2-train
license: bigcode-openrail-m
library_name: transformers
tags:
- code
model-index:
- name: starcoder2-3b
  results:
  - task:
      type: text-generation
    dataset:
      name: CruxEval-I
      type: cruxeval-i
    metrics:
    - type: pass@1
      value: 32.7
  - task:
      type: text-generation
    dataset:
      name: DS-1000
      type: ds-1000
    metrics:
    - type: pass@1
      value: 25.0
  - task:
      type: text-generation
    dataset:
      name: GSM8K (PAL)
      type: gsm8k-pal
    metrics:
    - type: accuracy
      value: 27.7
  - task:
      type: text-generation
    dataset:
      name: HumanEval+
      type: humanevalplus
    metrics:
    - type: pass@1
      value: 27.4
  - task:
      type: text-generation
    dataset:
      name: HumanEval
      type: humaneval
    metrics:
    - type: pass@1
      value: 31.7
  - task:
      type: text-generation
    dataset:
      name: RepoBench-v1.1
      type: repobench-v1.1
    metrics:
    - type: edit-smiliarity
      value: 71.19
---